title,book_category,price,star_rate,stock
A Light in the Attic,Poetry,£51.77,Three,        In stock (22 available)
Tipping the Velvet,Historical Fiction,£53.74,One,        In stock (20 available)
Soumission,Fiction,£50.10,One,        In stock (20 available)
Sharp Objects,Mystery,£47.82,Four,        In stock (20 available)
Sapiens: A Brief History of Humankind,History,£54.23,Five,        In stock (20 available)
The Requiem Red,Young Adult,£22.65,One,        In stock (19 available)
The Dirty Little Secrets of Getting Your Dream Job,Business,£33.34,Four,        In stock (19 available)
"The Coming Woman: A Novel Based on the Life of the Infamous Feminist, Victoria Woodhull",Default,£17.93,Three,        In stock (19 available)
The Boys in the Boat: Nine Americans and Their Epic Quest for Gold at the 1936 Berlin Olympics,Default,£22.60,Four,        In stock (19 available)
The Black Maria,Poetry,£52.15,One,        In stock (19 available)
"Starving Hearts (Triangular Trade Trilogy, #1)",Default,£13.99,Two,        In stock (19 available)
Shakespeare's Sonnets,Poetry,£20.66,Four,        In stock (19 available)
Set Me Free,Young Adult,£17.46,Five,        In stock (19 available)
Scott Pilgrim's Precious Little Life (Scott Pilgrim #1),Sequential Art,£52.29,Five,        In stock (19 available)
Rip it Up and Start Again,Music,£35.02,Five,        In stock (19 available)
"Our Band Could Be Your Life: Scenes from the American Indie Underground, 1981-1991",Music,£57.25,Three,        In stock (19 available)
Olio,Poetry,£23.88,One,        In stock (19 available)
Mesaerion: The Best Science Fiction Stories 1800-1849,Science Fiction,£37.59,One,        In stock (19 available)
Libertarianism for Beginners,Politics,£51.33,Two,        In stock (19 available)
It's Only the Himalayas,Travel,£45.17,Two,        In stock (19 available)
In Her Wake,Thriller,£12.84,One,        In stock (19 available)
How Music Works,Music,£37.32,Two,        In stock (19 available)
"Foolproof Preserving: A Guide to Small Batch Jams, Jellies, Pickles, Condiments, and More: A Foolproof Guide to Making Small Batch Jams, Jellies, Pickles, Condiments, and More",Food and Drink,£30.52,Three,        In stock (19 available)
Chase Me (Paris Nights #2),Romance,£25.27,Five,        In stock (19 available)
Black Dust,Romance,£34.53,Five,        In stock (19 available)
Birdsong: A Story in Pictures,Childrens,£54.64,Three,        In stock (19 available)
America's Cradle of Quarterbacks: Western Pennsylvania's Football Factory from Johnny Unitas to Joe Montana,Default,£22.50,Three,        In stock (19 available)
Aladdin and His Wonderful Lamp,Default,£53.13,Three,        In stock (19 available)
Worlds Elsewhere: Journeys Around Shakespeare’s Globe,Nonfiction,£40.30,Five,        In stock (18 available)
Wall and Piece,Art,£44.18,Four,        In stock (18 available)
The Four Agreements: A Practical Guide to Personal Freedom,Spirituality,£17.66,Five,        In stock (18 available)
The Five Love Languages: How to Express Heartfelt Commitment to Your Mate,Nonfiction,£31.05,Three,        In stock (18 available)
The Elephant Tree,Thriller,£23.82,Five,        In stock (18 available)
The Bear and the Piano,Childrens,£36.89,One,        In stock (18 available)
Sophie's World,Philosophy,£15.94,Five,        In stock (18 available)
Penny Maybe,Default,£33.29,Three,        In stock (18 available)
Maude (1883-1993):She Grew Up with the country,Default,£18.02,Two,        In stock (18 available)
"In a Dark, Dark Wood",Mystery,£19.63,One,        In stock (18 available)
Behind Closed Doors,Thriller,£52.22,Four,        In stock (18 available)
You can't bury them all: Poems,Poetry,£33.63,Two,        In stock (17 available)
Slow States of Collapse: Poems,Poetry,£57.31,Three,        In stock (17 available)
Reasons to Stay Alive,Nonfiction,£26.41,Two,        In stock (17 available)
Private Paris (Private #10),Fiction,£47.61,Five,        In stock (17 available)
#HigherSelfie: Wake Up Your Life. Free Your Soul. Find Your Tribe.,Nonfiction,£23.11,Five,        In stock (17 available)
Without Borders (Wanderlove #1),New Adult,£45.07,Two,        In stock (16 available)
When We Collided,Contemporary,£31.77,One,        In stock (16 available)
"We Love You, Charlie Freeman",Fiction,£50.27,Five,        In stock (16 available)
Untitled Collection: Sabbath Poems 2014,Poetry,£14.27,Four,        In stock (16 available)
"Unseen City: The Majesty of Pigeons, the Discreet Charm of Snails & Other Wonders of the Urban Wilderness",Nonfiction,£44.18,Four,        In stock (16 available)
Unicorn Tracks,Fantasy,£18.78,Three,        In stock (16 available)
"Unbound: How Eight Technologies Made Us Human, Transformed Society, and Brought Our World to the Brink",History,£25.52,One,        In stock (16 available)
Tsubasa: WoRLD CHRoNiCLE 2 (Tsubasa WoRLD CHRoNiCLE #2),Sequential Art,£16.28,One,        In stock (16 available)
Throwing Rocks at the Google Bus: How Growth Became the Enemy of Prosperity,Nonfiction,£31.12,Three,        In stock (16 available)
This One Summer,Sequential Art,£19.49,Four,        In stock (16 available)
Thirst,Fiction,£17.27,Five,        In stock (16 available)
The Torch Is Passed: A Harding Family Story,Add a comment,£19.09,One,        In stock (16 available)
The Secret of Dreadwillow Carse,Childrens,£56.13,One,        In stock (16 available)
"The Pioneer Woman Cooks: Dinnertime: Comfort Classics, Freezer Food, 16-Minute Meals, and Other Delicious Ways to Solve Supper!",Food and Drink,£56.41,One,        In stock (16 available)
The Past Never Ends,Mystery,£56.50,Four,        In stock (16 available)
The Natural History of Us (The Fine Art of Pretending #2),Young Adult,£45.22,Three,        In stock (16 available)
The Nameless City (The Nameless City #1),Sequential Art,£38.16,Four,        In stock (16 available)
The Murder That Never Was (Forensic Instincts #5),Fiction,£54.11,Three,        In stock (16 available)
The Most Perfect Thing: Inside (and Outside) a Bird's Egg,Science,£42.96,Four,        In stock (16 available)
"The Mindfulness and Acceptance Workbook for Anxiety: A Guide to Breaking Free from Anxiety, Phobias, and Worry Using Acceptance and Commitment Therapy",Add a comment,£23.89,Four,        In stock (16 available)
The Life-Changing Magic of Tidying Up: The Japanese Art of Decluttering and Organizing,Nonfiction,£16.77,Three,        In stock (16 available)
"The Inefficiency Assassin: Time Management Tactics for Working Smarter, Not Longer",Default,£20.59,Five,        In stock (16 available)
The Gutsy Girl: Escapades for Your Life of Epic Adventure,Nonfiction,£37.13,One,        In stock (16 available)
The Electric Pencil: Drawings from Inside State Hospital No. 3,Nonfiction,£56.06,One,        In stock (16 available)
The Death of Humanity: and the Case for Life,Philosophy,£58.11,Four,        In stock (16 available)
"The Bulletproof Diet: Lose up to a Pound a Day, Reclaim Energy and Focus, Upgrade Your Life",Health,£49.05,Three,        In stock (16 available)
The Art Forger,Add a comment,£40.76,Three,        In stock (16 available)
The Age of Genius: The Seventeenth Century and the Birth of the Modern Mind,History,£19.73,One,        In stock (16 available)
The Activist's Tao Te Ching: Ancient Advice for a Modern Revolution,Spirituality,£32.24,Five,        In stock (16 available)
Spark Joy: An Illustrated Master Class on the Art of Organizing and Tidying Up,Nonfiction,£41.83,Four,        In stock (16 available)
Soul Reader,Default,£39.58,Two,        In stock (16 available)
Security,Horror,£39.25,Two,        In stock (16 available)
"Saga, Volume 6 (Saga (Collected Editions) #6)",Fantasy,£25.02,Three,        In stock (16 available)
"Saga, Volume 5 (Saga (Collected Editions) #5)",Sequential Art,£51.04,Two,        In stock (16 available)
Reskilling America: Learning to Labor in the Twenty-First Century,Nonfiction,£19.83,Two,        In stock (16 available)
"Rat Queens, Vol. 3: Demons (Rat Queens (Collected Editions) #11-15)",Sequential Art,£50.40,Three,        In stock (16 available)
"Princess Jellyfish 2-in-1 Omnibus, Vol. 01 (Princess Jellyfish 2-in-1 Omnibus #1)",Sequential Art,£13.61,Five,        In stock (16 available)
Princess Between Worlds (Wide-Awake Princess #5),Fantasy,£13.34,Five,        In stock (16 available)
"Pop Gun War, Volume 1: Gift",Sequential Art,£18.97,One,        In stock (16 available)
"Political Suicide: Missteps, Peccadilloes, Bad Calls, Backroom Hijinx, Sordid Pasts, Rotten Breaks, and Just Plain Dumb Mistakes in the Annals of American Politics",History,£36.28,Two,        In stock (16 available)
Patience,Sequential Art,£10.16,Three,        In stock (16 available)
"Outcast, Vol. 1: A Darkness Surrounds Him (Outcast #1)",Sequential Art,£15.44,Four,        In stock (16 available)
orange: The Complete Collection 1 (orange: The Complete Collection #1),Sequential Art,£48.41,One,        In stock (16 available)
Online Marketing for Busy Authors: A Step-By-Step Guide,Self Help,£46.35,One,        In stock (16 available)
On a Midnight Clear,Add a comment,£14.07,Three,        In stock (16 available)
Obsidian (Lux #1),Young Adult,£14.86,Two,        In stock (16 available)
My Paris Kitchen: Recipes and Stories,Food and Drink,£33.37,Two,        In stock (16 available)
Masks and Shadows,Fantasy,£56.40,Two,        In stock (16 available)
"Mama Tried: Traditional Italian Cooking for the Screwed, Crude, Vegan, and Tattooed",Food and Drink,£14.02,Four,        In stock (16 available)
"Lumberjanes, Vol. 2: Friendship to the Max (Lumberjanes #5-8)",Sequential Art,£46.91,Two,        In stock (16 available)
"Lumberjanes, Vol. 1: Beware the Kitten Holy (Lumberjanes #1-4)",Sequential Art,£45.61,Three,        In stock (16 available)
Lumberjanes Vol. 3: A Terrible Plan (Lumberjanes #9-12),Sequential Art,£19.92,Two,        In stock (16 available)
"Layered: Baking, Building, and Styling Spectacular Cakes",Food and Drink,£40.11,One,        In stock (16 available)
Judo: Seven Steps to Black Belt (an Introductory Guide for Beginners),Add a comment,£53.90,Two,        In stock (16 available)
Join,Science Fiction,£35.67,Five,        In stock (16 available)
In the Country We Love: My Family Divided,Nonfiction,£22.00,Four,        In stock (16 available)
Immunity: How Elie Metchnikoff Changed the Course of Modern Medicine,Science,£57.36,Five,        In stock (16 available)
"I Hate Fairyland, Vol. 1: Madly Ever After (I Hate Fairyland (Compilations) #1-5)",Sequential Art,£29.17,Two,        In stock (16 available)
I am a Hero Omnibus Volume 1,Sequential Art,£54.63,Three,        In stock (16 available)
How to Be Miserable: 40 Strategies You Already Use,Self Help,£46.03,One,        In stock (16 available)
Her Backup Boyfriend (The Sorensen Family #1),Romance,£33.97,One,        In stock (16 available)
"Giant Days, Vol. 2 (Giant Days #5-8)",Sequential Art,£22.11,Two,        In stock (16 available)
Forever and Forever: The Courtship of Henry Longfellow and Fanny Appleton,Historical Fiction,£29.69,Three,        In stock (16 available)
First and First (Five Boroughs #3),Romance,£15.97,Four,        In stock (16 available)
Fifty Shades Darker (Fifty Shades #2),Romance,£21.96,One,        In stock (16 available)
Everydata: The Misinformation Hidden in the Little Data You Consume Every Day,Nonfiction,£54.35,Two,        In stock (16 available)
"Don't Be a Jerk: And Other Practical Advice from Dogen, Japan's Greatest Zen Master",Religion,£37.97,Two,        In stock (16 available)
Danganronpa Volume 1,Sequential Art,£51.99,Four,        In stock (16 available)
Crown of Midnight (Throne of Glass #2),Fantasy,£43.29,Three,        In stock (16 available)
"Codename Baboushka, Volume 1: The Conclave of Death",Sequential Art,£36.72,Four,        In stock (16 available)
Camp Midnight,Sequential Art,£17.08,Four,        In stock (16 available)
Call the Nurse: True Stories of a Country Nurse on a Scottish Isle,Nonfiction,£29.14,Five,        In stock (16 available)
Burning,Young Adult,£28.81,Three,        In stock (16 available)
Bossypants,Default,£49.46,Two,        In stock (16 available)
"Bitch Planet, Vol. 1: Extraordinary Machine (Bitch Planet (Collected Editions))",Sequential Art,£37.92,Two,        In stock (16 available)
"Avatar: The Last Airbender: Smoke and Shadow, Part 3 (Smoke and Shadow #3)",Fantasy,£28.09,Two,        In stock (16 available)
Algorithms to Live By: The Computer Science of Human Decisions,Nonfiction,£30.81,One,        In stock (16 available)
A World of Flavor: Your Gluten Free Passport,Default,£42.95,One,        In stock (16 available)
"A Piece of Sky, a Grain of Rice: A Memoir in Four Meditations",Default,£56.76,Five,        In stock (16 available)
A Murder in Time,Mystery,£16.64,One,        In stock (16 available)
A Flight of Arrows (The Pathfinders #2),Historical Fiction,£55.53,Five,        In stock (16 available)
A Fierce and Subtle Poison,Young Adult,£28.13,Four,        In stock (16 available)
A Court of Thorns and Roses (A Court of Thorns and Roses #1),Fantasy,£52.37,One,        In stock (16 available)
(Un)Qualified: How God Uses Broken People to Do Big Things,Christian,£54.00,Five,        In stock (16 available)
You Are What You Love: The Spiritual Power of Habit,Religion,£21.87,Four,        In stock (15 available)
"William Shakespeare's Star Wars: Verily, A New Hope (William Shakespeare's Star Wars #4)",Science Fiction,£43.30,Four,        In stock (15 available)
Tuesday Nights in 1980,Fiction,£21.04,Two,        In stock (15 available)
Tracing Numbers on a Train,Default,£41.60,Three,        In stock (15 available)
Throne of Glass (Throne of Glass #1),Fantasy,£35.07,Three,        In stock (15 available)
Thomas Jefferson and the Tripoli Pirates: The Forgotten War That Changed American History,History,£59.64,One,        In stock (15 available)
Thirteen Reasons Why,Default,£52.72,One,        In stock (15 available)
The White Cat and the Monk: A Retelling of the Poem “Pangur Bán”,Childrens,£58.08,Four,        In stock (15 available)
The Wedding Dress,Romance,£24.12,One,        In stock (15 available)
The Vacationers,Fiction,£42.15,Four,        In stock (15 available)
The Third Wave: An Entrepreneur’s Vision of the Future,Business,£12.61,Five,        In stock (15 available)
The Stranger,Philosophy,£17.44,Four,        In stock (15 available)
The Shadow Hero (The Shadow Hero),Sequential Art,£33.14,One,        In stock (15 available)
The Secret (The Secret #1),Default,£27.37,Four,        In stock (15 available)
The Regional Office Is Under Attack!,Fiction,£51.36,Five,        In stock (15 available)
The Psychopath Test: A Journey Through the Madness Industry,Default,£36.00,Two,        In stock (15 available)
The Project,Science Fiction,£10.65,One,        In stock (15 available)
The Power of Now: A Guide to Spiritual Enlightenment,Nonfiction,£43.54,Two,        In stock (15 available)
The Omnivore's Dilemma: A Natural History of Four Meals,Nonfiction,£38.21,Two,        In stock (15 available)
The Nerdy Nummies Cookbook: Sweet Treats for the Geek in All of Us,Food and Drink,£37.34,Five,        In stock (15 available)
The Murder of Roger Ackroyd (Hercule Poirot #4),Mystery,£44.10,Four,        In stock (15 available)
The Mistake (Off-Campus #2),New Adult,£43.29,Three,        In stock (15 available)
The Matchmaker's Playbook (Wingmen Inc. #1),New Adult,£55.85,One,        In stock (15 available)
The Love and Lemons Cookbook: An Apple-to-Zucchini Celebration of Impromptu Cooking,Food and Drink,£37.60,Two,        In stock (15 available)
The Long Shadow of Small Ghosts: Murder and Memory in an American City,Crime,£10.97,One,        In stock (15 available)
The Kite Runner,Default,£41.82,Four,        In stock (15 available)
The House by the Lake,Historical Fiction,£36.95,One,        In stock (15 available)
The Glittering Court (The Glittering Court #1),Fantasy,£44.28,One,        In stock (15 available)
The Girl on the Train,Default,£55.02,Two,        In stock (15 available)
The Genius of Birds,Nonfiction,£17.24,One,        In stock (15 available)
The Emerald Mystery,Default,£23.15,Two,        In stock (15 available)
The Cookies & Cups Cookbook: 125+ sweet & savory recipes reminding you to Always Eat Dessert First,Food and Drink,£41.25,One,        In stock (15 available)
The Bridge to Consciousness: I'm Writing the Bridge Between Science and Our Old and New Beliefs.,Default,£32.00,Three,        In stock (15 available)
The Artist's Way: A Spiritual Path to Higher Creativity,Nonfiction,£38.49,Five,        In stock (15 available)
The Art of War,Default,£33.34,Five,        In stock (15 available)
The Argonauts,Autobiography,£10.93,Two,        In stock (15 available)
The 10% Entrepreneur: Live Your Startup Dream Without Quitting Your Day Job,Business,£27.55,Three,        In stock (15 available)
Suddenly in Love (Lake Haven #1),Romance,£55.99,Two,        In stock (15 available)
Something More Than This,Romance,£16.24,Four,        In stock (15 available)
Soft Apocalypse,Science Fiction,£26.12,Two,        In stock (15 available)
So You've Been Publicly Shamed,Nonfiction,£12.23,Two,        In stock (15 available)
Shoe Dog: A Memoir by the Creator of NIKE,Business,£23.99,Two,        In stock (15 available)
"Shobu Samurai, Project Aryoku (#3)",Add a comment,£29.06,Three,        In stock (15 available)
Secrets and Lace (Fatal Hearts #1),Default,£20.27,One,        In stock (15 available)
Scarlett Epstein Hates It Here,Young Adult,£43.55,Five,        In stock (15 available)
Romero and Juliet: A Tragic Tale of Love and Zombies,Default,£36.94,One,        In stock (15 available)
Redeeming Love,Christian Fiction,£20.47,Five,        In stock (15 available)
Poses for Artists Volume 1 - Dynamic and Sitting Poses: An Essential Reference for Figure Drawing and the Human Form,Default,£41.06,One,        In stock (15 available)
Poems That Make Grown Women Cry,Poetry,£14.19,Four,        In stock (15 available)
"Nightingale, Sing",Young Adult,£38.28,One,        In stock (15 available)
Night Sky with Exit Wounds,Poetry,£41.05,One,        In stock (15 available)
Mrs. Houdini,Historical Fiction,£30.25,Five,        In stock (15 available)
Modern Romance,Add a comment,£28.26,Five,        In stock (15 available)
Miss Peregrine’s Home for Peculiar Children (Miss Peregrine’s Peculiar Children #1),Default,£10.76,One,        In stock (15 available)
Louisa: The Extraordinary Life of Mrs. Adams,Biography,£16.85,Two,        In stock (15 available)
Little Red,Childrens,£13.47,Three,        In stock (15 available)
Library of Souls (Miss Peregrine’s Peculiar Children #3),Young Adult,£48.56,Five,        In stock (15 available)
Large Print Heart of the Pride,Default,£19.15,Two,        In stock (15 available)
I Had a Nice Time And Other Lies...: How to find love & sh*t like that,Womens Fiction,£57.36,Four,        In stock (15 available)
Hollow City (Miss Peregrine’s Peculiar Children #2),Fantasy,£42.98,One,        In stock (15 available)
Grumbles,Default,£22.16,Two,        In stock (15 available)
Full Moon over Noah’s Ark: An Odyssey to Mount Ararat and Beyond,Travel,£49.43,Four,        In stock (15 available)
Frostbite (Vampire Academy #2),Young Adult,£29.99,Five,        In stock (15 available)
Follow You Home,Horror,£21.36,One,        In stock (15 available)
First Steps for New Christians (Print Edition),Default,£29.00,One,        In stock (15 available)
Finders Keepers (Bill Hodges Trilogy #2),Fiction,£53.53,Five,        In stock (15 available)
"Fables, Vol. 1: Legends in Exile (Fables #1)",Sequential Art,£41.62,Four,        In stock (15 available)
Eureka Trivia 6.0,Default,£54.59,Four,        In stock (15 available)
Drive: The Surprising Truth About What Motivates Us,Default,£34.95,Four,        In stock (15 available)
Done Rubbed Out (Reightman & Bailey #1),Default,£37.72,Five,        In stock (15 available)
Doing It Over (Most Likely To #1),Romance,£35.61,Three,        In stock (15 available)
"Deliciously Ella Every Day: Quick and Easy Recipes for Gluten-Free Snacks, Packed Lunches, and Simple Meals",Food and Drink,£42.16,Three,        In stock (15 available)
Dark Notes,Erotica,£19.19,Five,        In stock (15 available)
"Daring Greatly: How the Courage to Be Vulnerable Transforms the Way We Live, Love, Parent, and Lead",Nonfiction,£19.43,Three,        In stock (15 available)
Close to You,Christian Fiction,£49.46,Four,        In stock (15 available)
Chasing Heaven: What Dying Taught Me About Living,Spirituality,£37.80,Two,        In stock (15 available)
Big Magic: Creative Living Beyond Fear,Nonfiction,£30.80,Three,        In stock (15 available)
Becoming Wise: An Inquiry into the Mystery and Art of Living,Nonfiction,£27.43,Two,        In stock (15 available)
Beauty Restored (Riley Family Legacy Novellas #3),Default,£11.11,Two,        In stock (15 available)
Batman: The Long Halloween (Batman),Sequential Art,£36.50,Two,        In stock (15 available)
Batman: The Dark Knight Returns (Batman),Sequential Art,£15.38,Five,        In stock (15 available)
Ayumi's Violin,Default,£15.48,Two,        In stock (15 available)
Anonymous,Default,£46.82,Four,        In stock (15 available)
Amy Meets the Saints and Sages,Default,£18.46,Three,        In stock (15 available)
Amid the Chaos,Cultural,£36.58,One,        In stock (15 available)
Amatus,Default,£50.54,Five,        In stock (15 available)
Agnostic: A Spirited Manifesto,Nonfiction,£12.51,Five,        In stock (15 available)
Zealot: The Life and Times of Jesus of Nazareth,History,£24.70,Three,        In stock (14 available)
You (You #1),Thriller,£43.61,Five,        In stock (14 available)
"Wonder Woman: Earth One, Volume One (Wonder Woman: Earth One #1)",Sequential Art,£37.34,Four,        In stock (14 available)
Wild Swans,Young Adult,£14.36,Two,        In stock (14 available)
Why the Right Went Wrong: Conservatism--From Goldwater to the Tea Party and Beyond,Politics,£52.65,Four,        In stock (14 available)
Whole Lotta Creativity Going On: 60 Fun and Unusual Exercises to Awaken and Strengthen Your Creativity,Nonfiction,£38.20,Four,        In stock (14 available)
What's It Like in Space?: Stories from Astronauts Who've Been There,Nonfiction,£19.60,Two,        In stock (14 available)
"We Are Robin, Vol. 1: The Vigilante Business (We Are Robin #1)",Sequential Art,£53.90,One,        In stock (14 available)
Walt Disney's Alice in Wonderland,Childrens,£12.96,Five,        In stock (14 available)
V for Vendetta (V for Vendetta Complete),Default,£37.10,Four,        In stock (14 available)
Until Friday Night (The Field Party #1),Young Adult,£46.31,Two,        In stock (14 available)
"Unbroken: A World War II Story of Survival, Resilience, and Redemption",Default,£45.95,Two,        In stock (14 available)
Twenty Yawns,Childrens,£22.08,Two,        In stock (14 available)
Through the Woods,Sequential Art,£25.38,Two,        In stock (14 available)
This Is Where It Ends,Young Adult,£27.12,Two,        In stock (14 available)
The Year of Magical Thinking,Nonfiction,£43.04,Two,        In stock (14 available)
The Wright Brothers,Default,£56.80,Four,        In stock (14 available)
The White Queen (The Cousins' War #1),Add a comment,£25.91,Five,        In stock (14 available)
The Wedding Pact (The O'Malleys #2),Romance,£32.61,Three,        In stock (14 available)
The Time Keeper,Fiction,£27.88,Five,        In stock (14 available)
The Testament of Mary,Fiction,£52.67,Four,        In stock (14 available)
The Star-Touched Queen,Fantasy,£46.02,Five,        In stock (14 available)
The Star-Touched Queen,Fantasy,£32.30,Five,        In stock (14 available)
The Songs of the Gods,Default,£44.48,Five,        In stock (14 available)
The Song of Achilles,Add a comment,£37.40,Five,        In stock (14 available)
The Rosie Project (Don Tillman #1),Default,£54.04,One,        In stock (14 available)
The Power of Habit: Why We Do What We Do in Life and Business,Default,£16.88,Three,        In stock (14 available)
The Marriage of Opposites,Historical Fiction,£28.08,Four,        In stock (14 available)
The Lucifer Effect: Understanding How Good People Turn Evil,Psychology,£10.40,One,        In stock (14 available)
The Long Haul (Diary of a Wimpy Kid #9),Humor,£44.07,One,        In stock (14 available)
The Loney,Horror,£23.40,One,        In stock (14 available)
The Literature Book (Big Ideas Simply Explained),Nonfiction,£17.43,Three,        In stock (14 available)
The Last Mile (Amos Decker #2),Mystery,£54.21,Two,        In stock (14 available)
The Immortal Life of Henrietta Lacks,Add a comment,£40.67,Two,        In stock (14 available)
The Hidden Oracle (The Trials of Apollo #1),Fantasy,£52.26,Two,        In stock (14 available)
The Help Yourself Cookbook for Kids: 60 Easy Plant-Based Recipes Kids Can Make to Stay Healthy and Save the Earth,Food and Drink,£28.77,Three,        In stock (14 available)
The Guilty (Will Robie #4),Thriller,£13.82,Two,        In stock (14 available)
The First Hostage (J.B. Collins #2),Fiction,£25.85,Three,        In stock (14 available)
The Dovekeepers,Add a comment,£48.78,One,        In stock (14 available)
The Darkest Lie,Young Adult,£35.35,Five,        In stock (14 available)
The Bane Chronicles (The Bane Chronicles #1-11),Fantasy,£44.73,Four,        In stock (14 available)
The Bad-Ass Librarians of Timbuktu: And Their Race to Save the World’s Most Precious Manuscripts,Nonfiction,£15.77,One,        In stock (14 available)
The 14th Colony (Cotton Malone #11),Thriller,£39.24,One,        In stock (14 available)
That Darkness (Gardiner and Renner #1),Mystery,£13.92,One,        In stock (14 available)
Tastes Like Fear (DI Marnie Rome #3),Mystery,£10.69,One,        In stock (14 available)
Take Me with You,Fiction,£45.21,Three,        In stock (14 available)
