title,book_category,price,star_rate,stock
How to Cook Everything Vegetarian: Simple Meatless Recipes for Great Food (How to Cook Everything),Food and Drink,£46.01,Four,        In stock (7 available)
How to Be a Domestic Goddess: Baking and the Art of Comfort Cooking,Food and Drink,£28.25,Two,        In stock (7 available)
Good in Bed (Cannie Shapiro #1),Add a comment,£37.05,Five,        In stock (7 available)
"Fruits Basket, Vol. 7 (Fruits Basket #7)",Sequential Art,£19.57,One,        In stock (7 available)
For the Love: Fighting for Grace in a World of Impossible Standards,Nonfiction,£45.13,Three,        In stock (7 available)
Finding God in the Ruins: How God Redeems Pain,Nonfiction,£46.64,Two,        In stock (7 available)
Every Heart a Doorway (Every Heart A Doorway #1),Fantasy,£12.16,Five,        In stock (7 available)
Delivering the Truth (Quaker Midwife Mystery #1),Mystery,£20.89,Four,        In stock (7 available)
Counted With the Stars (Out from Egypt #1),Christian Fiction,£17.97,Five,        In stock (7 available)
"Chronicles, Vol. 1",Music,£52.60,Two,        In stock (7 available)
Blue Like Jazz: Nonreligious Thoughts on Christian Spirituality,Christian,£25.77,One,        In stock (7 available)
Benjamin Franklin: An American Life,Biography,£48.19,Three,        In stock (7 available)
"At The Existentialist Café: Freedom, Being, and apricot cocktails with: Jean-Paul Sartre, Simone de Beauvoir, Albert Camus, Martin Heidegger, Edmund Husserl, Karl Jaspers, Maurice Merleau-Ponty and others",Philosophy,£29.93,Five,        In stock (7 available)
A Summer In Europe,Travel,£44.34,Two,        In stock (7 available)
A Short History of Nearly Everything,History,£52.40,Five,        In stock (7 available)
A Gathering of Shadows (Shades of Magic #2),Fantasy,£44.81,Four,        In stock (7 available)
The Sound Of Love,Default,£57.84,Five,        In stock (6 available)
The Rise and Fall of the Third Reich: A History of Nazi Germany,History,£39.67,Two,        In stock (6 available)
The Perks of Being a Wallflower,Default,£55.02,Three,        In stock (6 available)
The Mysterious Affair at Styles (Hercule Poirot #1),Mystery,£24.80,Four,        In stock (6 available)
The Man Who Mistook His Wife for a Hat and Other Clinical Tales,Nonfiction,£59.45,Four,        In stock (6 available)
The Makings of a Fatherless Child,Default,£31.58,Two,        In stock (6 available)
The Joy of Cooking,Add a comment,£43.27,Four,        In stock (6 available)
The Invention of Wings,Historical Fiction,£37.34,One,        In stock (6 available)
The Hobbit (Middle-Earth Universe),Default,£17.80,Five,        In stock (6 available)
The Great Railway Bazaar,Travel,£30.54,One,        In stock (6 available)
The Golden Compass (His Dark Materials #1),Add a comment,£18.77,One,        In stock (6 available)
The God Delusion,Add a comment,£46.85,Three,        In stock (6 available)
The Girl You Left Behind (The Girl You Left Behind #1),Historical,£15.79,One,        In stock (6 available)
The Fellowship of the Ring (The Lord of the Rings #1),Default,£10.27,Two,        In stock (6 available)
The Collected Poems of W.B. Yeats (The Collected Works of W.B. Yeats #1),Poetry,£15.42,Five,        In stock (6 available)
The Barefoot Contessa Cookbook,Food and Drink,£59.92,Five,        In stock (6 available)
Tell the Wolves I'm Home,Young Adult,£50.96,Two,        In stock (6 available)
Ship Leaves Harbor: Essays on Travel by a Recovering Journeyman,Default,£30.60,Three,        In stock (6 available)
Pride and Prejudice,Add a comment,£19.27,Four,        In stock (6 available)
Musicophilia: Tales of Music and the Brain,Default,£46.58,One,        In stock (6 available)
Mere Christianity,Add a comment,£48.51,Three,        In stock (6 available)
Me Before You (Me Before You #1),Fiction,£19.02,One,        In stock (6 available)
In the Woods (Dublin Murder Squad #1),Mystery,£38.38,Two,        In stock (6 available)
In Cold Blood,Nonfiction,£49.98,Four,        In stock (6 available)
How to Stop Worrying and Start Living,Self Help,£46.49,Five,        In stock (6 available)
Give It Back,Thriller,£18.32,Two,        In stock (6 available)
"Girl, Interrupted",Nonfiction,£42.14,Three,        In stock (6 available)
Fun Home: A Family Tragicomic,Add a comment,£56.59,Four,        In stock (6 available)
"Fruits Basket, Vol. 6 (Fruits Basket #6)",Sequential Art,£20.96,Four,        In stock (6 available)
Deception Point,Fiction,£40.32,Four,        In stock (6 available)
"Death Note, Vol. 6: Give-and-Take (Death Note #6)",Sequential Art,£36.39,Three,        In stock (6 available)
Catherine the Great: Portrait of a Woman,History,£58.55,Four,        In stock (6 available)
Better Homes and Gardens New Cook Book,Food and Drink,£39.61,Three,        In stock (6 available)
An Unquiet Mind: A Memoir of Moods and Madness,Psychology,£21.30,Three,        In stock (6 available)
A Year in Provence (Provence #1),Travel,£56.88,Four,        In stock (6 available)
World Without End (The Pillars of the Earth #2),Historical Fiction,£32.97,Four,        In stock (5 available)
"Will Grayson, Will Grayson (Will Grayson, Will Grayson)",Young Adult,£47.31,Four,        In stock (5 available)
Why Save the Bankers?: And Other Essays on Our Economic and Political Crisis,Nonfiction,£48.67,Two,        In stock (5 available)
Where She Went (If I Stay #2),Young Adult,£41.73,Four,        In stock (5 available)
What If?: Serious Scientific Answers to Absurd Hypothetical Questions,Default,£53.68,Four,        In stock (5 available)
Two Summers,Young Adult,£14.64,One,        In stock (5 available)
This Is Your Brain on Music: The Science of a Human Obsession,Music,£38.40,One,        In stock (5 available)
The Secret Garden,Classics,£15.08,Four,        In stock (5 available)
The Raven King (The Raven Cycle #4),Add a comment,£30.57,Two,        In stock (5 available)
The Raven Boys (The Raven Cycle #1),Fantasy,£57.74,Four,        In stock (5 available)
The Power Greens Cookbook: 140 Delicious Superfood Recipes,Food and Drink,£11.05,Five,        In stock (5 available)
The Metamorphosis,Classics,£28.58,One,        In stock (5 available)
The Mathews Men: Seven Brothers and the War Against Hitler's U-boats,History,£42.91,Five,        In stock (5 available)
The Little Paris Bookshop,Fiction,£24.73,Three,        In stock (5 available)
The Hiding Place,History,£55.91,Four,        In stock (5 available)
The Grand Design,Science,£13.76,Three,        In stock (5 available)
The Firm,Fiction,£45.56,Three,        In stock (5 available)
The Fault in Our Stars,Default,£47.22,One,        In stock (5 available)
The False Prince (The Ascendance Trilogy #1),Fantasy,£56.00,Five,        In stock (5 available)
The Expatriates,Fiction,£44.58,Two,        In stock (5 available)
The Dream Thieves (The Raven Cycle #2),Default,£34.50,One,        In stock (5 available)
The Darkest Corners,Young Adult,£11.33,Five,        In stock (5 available)
The Crossover,Poetry,£38.77,Four,        In stock (5 available)
The 5th Wave (The 5th Wave #1),Default,£11.83,Two,        In stock (5 available)
Tell the Wind and Fire,Fantasy,£45.51,Three,        In stock (5 available)
Tell Me Three Things,Young Adult,£41.81,One,        In stock (5 available)
Talking to Girls About Duran Duran: One Young Man's Quest for True Love and a Cooler Haircut,Nonfiction,£25.15,Four,        In stock (5 available)
Siddhartha,Fiction,£34.22,Five,        In stock (5 available)
Shiver (The Wolves of Mercy Falls #1),Default,£16.23,Five,        In stock (5 available)
Remember Me?,Default,£11.48,Three,        In stock (5 available)
Red Dragon (Hannibal Lecter #1),Horror,£23.37,Three,        In stock (5 available)
Peak: Secrets from the New Science of Expertise,Science,£16.28,Two,        In stock (5 available)
My Mother Was Nuts,Nonfiction,£31.63,Four,        In stock (5 available)
Mexican Today: New and Rediscovered Recipes for Contemporary Kitchens,Food and Drink,£24.91,Five,        In stock (5 available)
Maybe Something Beautiful: How Art Transformed a Neighborhood,Childrens,£22.54,One,        In stock (5 available)
Lola and the Boy Next Door (Anna and the French Kiss #2),Young Adult,£23.63,Four,        In stock (5 available)
Logan Kade (Fallen Crest High #5.5),Academic,£13.12,Two,        In stock (5 available)
Last One Home (New Beginnings #1),Fiction,£59.98,Three,        In stock (5 available)
Killing Floor (Jack Reacher #1),Thriller,£31.49,Four,        In stock (5 available)
Kill the Boy Band,Young Adult,£15.52,Five,        In stock (5 available)
Isla and the Happily Ever After (Anna and the French Kiss #3),Young Adult,£48.13,Five,        In stock (5 available)
If I Stay (If I Stay #1),Default,£38.13,Five,        In stock (5 available)
I Know Why the Caged Bird Sings (Maya Angelou's Autobiography #1),Default,£36.55,Two,        In stock (5 available)
Harry Potter and the Deathly Hallows (Harry Potter #7),Default,£23.32,One,        In stock (5 available)
"Fruits Basket, Vol. 5 (Fruits Basket #5)",Sequential Art,£16.33,One,        In stock (5 available)
Foundation (Foundation (Publication Order) #1),Science Fiction,£32.42,One,        In stock (5 available)
Fool Me Once,Default,£16.96,One,        In stock (5 available)
Find Her (Detective D.D. Warren #8),Add a comment,£22.37,One,        In stock (5 available)
Evicted: Poverty and Profit in the American City,Add a comment,£42.27,One,        In stock (5 available)
Drama,Default,£38.70,Two,        In stock (5 available)
Dracula the Un-Dead,Horror,£35.63,Five,        In stock (5 available)
Digital Fortress,Fiction,£58.00,Five,        In stock (5 available)
"Death Note, Vol. 5: Whiteout (Death Note #5)",Sequential Art,£52.41,One,        In stock (5 available)
"Data, A Love Story: How I Gamed Online Dating to Meet My Match",Nonfiction,£32.35,Three,        In stock (5 available)
Critique of Pure Reason,Philosophy,£20.75,One,        In stock (5 available)
Booked,Poetry,£17.49,Five,        In stock (5 available)
"Blue Lily, Lily Blue (The Raven Cycle #3)",Default,£34.13,Five,        In stock (5 available)
Approval Junkie: Adventures in Caring Too Much,Autobiography,£58.81,Five,        In stock (5 available)
An Abundance of Katherines,Young Adult,£10.00,Five,        In stock (5 available)
America's War for the Greater Middle East: A Military History,History,£51.22,Two,        In stock (5 available)
Alight (The Generations Trilogy #2),Default,£58.59,Four,        In stock (5 available)
A Girl's Guide to Moving On (New Beginnings #2),Romance,£31.30,One,        In stock (5 available)
A Game of Thrones (A Song of Ice and Fire #1),Add a comment,£46.42,Two,        In stock (5 available)
A Feast for Crows (A Song of Ice and Fire #4),Fantasy,£17.21,Four,        In stock (5 available)
A Clash of Kings (A Song of Ice and Fire #2),Add a comment,£10.79,Three,        In stock (5 available)
Vogue Colors A to Z: A Fashion Coloring Book,Default,£52.35,Four,        In stock (4 available)
The Shining (The Shining #1),Default,£27.88,Three,        In stock (4 available)
The Pilgrim's Progress,Classics,£50.26,Two,        In stock (4 available)
The Perfect Play (Play by Play #1),Romance,£59.99,Three,        In stock (4 available)
The Passion of Dolssa,Historical Fiction,£28.32,Five,        In stock (4 available)
The Jazz of Physics: The Secret Link Between Music and the Structure of the Universe,Nonfiction,£38.71,Three,        In stock (4 available)
The Hunger Games (The Hunger Games #1),Default,£29.85,Five,        In stock (4 available)
The Hound of the Baskervilles (Sherlock Holmes #5),Classics,£14.82,Two,        In stock (4 available)
The Gunning of America: Business and the Making of American Gun Culture,Nonfiction,£16.81,Four,        In stock (4 available)
The Geography of Bliss: One Grump's Search for the Happiest Places in the World,Nonfiction,£28.23,Two,        In stock (4 available)
The Demonists (Demonist #1),Fantasy,£52.11,Two,        In stock (4 available)
"The Demon Prince of Momochi House, Vol. 4 (The Demon Prince of Momochi House #4)",Sequential Art,£27.88,Two,        In stock (4 available)
The Bone Hunters (Lexy Vaughan & Steven Macaulay #2),Thriller,£59.71,Three,        In stock (4 available)
The Beast (Black Dagger Brotherhood #14),Fantasy,£46.08,Five,        In stock (4 available)
Some Women,Womens Fiction,£13.73,Five,        In stock (4 available)
Shopaholic Ties the Knot (Shopaholic #3),Womens Fiction,£48.39,Five,        In stock (4 available)
Paper and Fire (The Great Library #2),Fantasy,£49.45,Five,        In stock (4 available)
Outlander (Outlander #1),Default,£19.67,Five,        In stock (4 available)
"Orchestra of Exiles: The Story of Bronislaw Huberman, the Israel Philharmonic, and the One Thousand Jews He Saved from Nazi Horrors",Music,£12.36,Three,        In stock (4 available)
No One Here Gets Out Alive,Music,£20.02,Five,        In stock (4 available)
Night Shift (Night Shift #1-20),Horror,£12.75,Four,        In stock (4 available)
Needful Things,Horror,£47.51,Four,        In stock (4 available)
Mockingjay (The Hunger Games #3),Default,£20.44,Four,        In stock (4 available)
Misery,Horror,£34.79,Two,        In stock (4 available)
Little Women (Little Women #1),Classics,£28.07,Four,        In stock (4 available)
It,Horror,£25.01,Three,        In stock (4 available)
Harry Potter and the Sorcerer's Stone (Harry Potter #1),Default,£13.90,Three,        In stock (4 available)
Harry Potter and the Prisoner of Azkaban (Harry Potter #3),Young Adult,£24.17,Four,        In stock (4 available)
Harry Potter and the Order of the Phoenix (Harry Potter #5),Fantasy,£31.63,Four,        In stock (4 available)
Harry Potter and the Half-Blood Prince (Harry Potter #6),Fantasy,£48.75,Five,        In stock (4 available)
Harry Potter and the Chamber of Secrets (Harry Potter #2),Fantasy,£14.74,One,        In stock (4 available)
Gone with the Wind,Classics,£32.49,Three,        In stock (4 available)
God Is Not Great: How Religion Poisons Everything,Nonfiction,£27.80,One,        In stock (4 available)
Girl With a Pearl Earring,Historical Fiction,£26.77,One,        In stock (4 available)
"Fruits Basket, Vol. 4 (Fruits Basket #4)",Sequential Art,£50.44,Four,        In stock (4 available)
Far From True (Promise Falls Trilogy #2),Thriller,£34.93,Two,        In stock (4 available)
Dark Lover (Black Dagger Brotherhood #1),Romance,£12.87,One,        In stock (4 available)
Confessions of a Shopaholic (Shopaholic #1),Default,£48.94,Two,        In stock (4 available)
Changing the Game (Play by Play #2),Romance,£13.38,Three,        In stock (4 available)
Candide,Classics,£58.63,Three,        In stock (4 available)
Can You Keep a Secret?,Womens Fiction,£21.94,One,        In stock (4 available)
Atlas Shrugged,Fiction,£26.58,Five,        In stock (4 available)
Animal Farm,Classics,£57.22,Three,        In stock (4 available)
A Walk to Remember,Romance,£56.43,One,        In stock (4 available)
A New Earth: Awakening to Your Life's Purpose,Spirituality,£55.65,Five,        In stock (4 available)
"A History of God: The 4,000-Year Quest of Judaism, Christianity, and Islam",Religion,£27.62,One,        In stock (4 available)
'Salem's Lot,Horror,£49.56,Four,        In stock (4 available)
Zero History (Blue Ant #3),Default,£34.77,One,        In stock (3 available)
Wuthering Heights,Classics,£17.73,Three,        In stock (3 available)
World War Z: An Oral History of the Zombie War,Default,£21.80,One,        In stock (3 available)
Wild: From Lost to Found on the Pacific Crest Trail,Default,£46.02,Three,        In stock (3 available)
"Where'd You Go, Bernadette",Default,£18.13,One,        In stock (3 available)
When You Are Engulfed in Flames,Humor,£30.89,Five,        In stock (3 available)
We the People: The Modern-Day Figures Who Have Reshaped and Affirmed the Founding Fathers' Vision of America,Nonfiction,£31.95,Three,        In stock (3 available)
We Are All Completely Beside Ourselves,Contemporary,£24.04,One,        In stock (3 available)
Walk the Edge (Thunder Road #2),Young Adult,£32.36,Three,        In stock (3 available)
Voyager (Outlander #3),Historical Fiction,£21.07,Five,        In stock (3 available)
Very Good Lives: The Fringe Benefits of Failure and the Importance of Imagination,Nonfiction,£50.66,Three,        In stock (3 available)
Vegan Vegetarian Omnivore: Dinner for Everyone at the Table,Food and Drink,£13.66,Two,        In stock (3 available)
"Unstuffed: Decluttering Your Home, Mind, and Soul",Nonfiction,£58.09,One,        In stock (3 available)
Under the Banner of Heaven: A Story of Violent Faith,Nonfiction,£30.00,One,        In stock (3 available)
Two Boys Kissing,Young Adult,£32.74,Two,        In stock (3 available)
Twilight (Twilight #1),Default,£41.93,Two,        In stock (3 available)
Twenties Girl,Womens Fiction,£42.80,Two,        In stock (3 available)
"Trespassing Across America: One Man's Epic, Never-Done-Before (and Sort of Illegal) Hike Across the Heartland",Nonfiction,£53.51,One,        In stock (3 available)
Three-Martini Lunch,Fiction,£23.21,Three,        In stock (3 available)
"Thinking, Fast and Slow",Psychology,£21.14,One,        In stock (3 available)
The Wild Robot,Childrens,£56.07,Three,        In stock (3 available)
"The Wicked + The Divine, Vol. 3: Commercial Suicide (The Wicked + The Divine)",Sequential Art,£14.41,Three,        In stock (3 available)
The Undomestic Goddess,Womens Fiction,£45.75,Four,        In stock (3 available)
The Travelers,Thriller,£15.77,One,        In stock (3 available)
The Tipping Point: How Little Things Can Make a Big Difference,Add a comment,£10.02,Two,        In stock (3 available)
The Thing About Jellyfish,Childrens,£48.77,One,        In stock (3 available)
The Stand,Horror,£57.86,Two,        In stock (3 available)
The Smitten Kitchen Cookbook,Food and Drink,£23.59,One,        In stock (3 available)
The Silkworm (Cormoran Strike #2),Mystery,£23.05,Five,        In stock (3 available)
"The Sandman, Vol. 3: Dream Country (The Sandman (volumes) #3)",Sequential Art,£55.55,Five,        In stock (3 available)
The Rose & the Dagger (The Wrath and the Dawn #2),Fantasy,£58.64,Four,        In stock (3 available)
The Road to Little Dribbling: Adventures of an American in Britain (Notes From a Small Island #2),Travel,£23.21,One,        In stock (3 available)
The Rise of Theodore Roosevelt (Theodore Roosevelt #1),Biography,£42.57,Three,        In stock (3 available)
The Restaurant at the End of the Universe (Hitchhiker's Guide to the Galaxy #2),Science Fiction,£10.92,One,        In stock (3 available)
The Rest Is Noise: Listening to the Twentieth Century,Add a comment,£34.77,One,        In stock (3 available)
The Red Tent,Historical Fiction,£35.66,Five,        In stock (3 available)
The Purpose Driven Life: What on Earth Am I Here for?,Add a comment,£37.19,Three,        In stock (3 available)
The Purest Hook (Second Circle Tattoos #3),Romance,£12.25,One,        In stock (3 available)
The Picture of Dorian Gray,Classics,£29.70,Two,        In stock (3 available)
The Paris Wife,Default,£36.80,Three,        In stock (3 available)
The Obsession,Romance,£45.43,One,        In stock (3 available)
The Nightingale,Fiction,£26.26,Four,        In stock (3 available)
The New Guy (and Other Senior Year Distractions),Young Adult,£44.92,Three,        In stock (3 available)
The Nanny Diaries (Nanny #1),Womens Fiction,£52.53,Five,        In stock (3 available)
The Name of God is Mercy,Nonfiction,£37.25,Two,        In stock (3 available)
The Maze Runner (The Maze Runner #1),Default,£20.93,One,        In stock (3 available)
The Lover's Dictionary,Default,£58.09,Two,        In stock (3 available)
The Lonely Ones,Childrens,£43.59,Five,        In stock (3 available)
The Lean Startup: How Today's Entrepreneurs Use Continuous Innovation to Create Radically Successful Businesses,Business,£33.92,Three,        In stock (3 available)
The Last Painting of Sara de Vos,Historical Fiction,£55.55,Two,        In stock (3 available)
"The Land of 10,000 Madonnas",Young Adult,£29.64,Four,        In stock (3 available)
The Infinities,Fiction,£27.41,One,        In stock (3 available)
The Husband's Secret,Fiction,£52.51,Five,        In stock (3 available)
The Hitchhiker's Guide to the Galaxy (Hitchhiker's Guide to the Galaxy #1),Add a comment,£47.80,Three,        In stock (3 available)
The Guns of August,History,£14.54,Two,        In stock (3 available)
The Guernsey Literary and Potato Peel Pie Society,Historical Fiction,£49.53,One,        In stock (3 available)
The Goldfinch,Default,£43.58,Three,        In stock (3 available)
The Giver (The Giver Quartet #1),Default,£12.30,One,        In stock (3 available)
The Girl with All the Gifts,Horror,£49.47,Three,        In stock (3 available)
The Girl Who Played with Fire (Millennium Trilogy #2),Default,£22.14,Two,        In stock (3 available)
The Girl Who Kicked the Hornet's Nest (Millennium Trilogy #3),Add a comment,£57.48,One,        In stock (3 available)
The Exiled,Mystery,£43.45,Three,        In stock (3 available)
"The End of Faith: Religion, Terror, and the Future of Reason",Add a comment,£22.13,Four,        In stock (3 available)
"The Elegant Universe: Superstrings, Hidden Dimensions, and the Quest for the Ultimate Theory",Science,£13.03,Four,        In stock (3 available)
"The Disappearing Spoon: And Other True Tales of Madness, Love, and the History of the World from the Periodic Table of the Elements",Science,£57.35,Five,        In stock (3 available)
The Devil Wears Prada (The Devil Wears Prada #1),Womens Fiction,£44.29,One,        In stock (3 available)
The Demon-Haunted World: Science as a Candle in the Dark,Default,£52.25,Four,        In stock (3 available)
The Day the Crayons Came Home (Crayons),Childrens,£26.33,Five,        In stock (3 available)
The Da Vinci Code (Robert Langdon #2),Fiction,£22.96,Two,        In stock (3 available)
The Cuckoo's Calling (Cormoran Strike #1),Mystery,£19.21,One,        In stock (3 available)
The Complete Stories and Poems (The Works of Edgar Allan Poe [Cameo Edition]),Classics,£26.78,Four,        In stock (3 available)
The Complete Poems,Add a comment,£41.32,Five,        In stock (3 available)
The Catcher in the Rye,Add a comment,£24.55,One,        In stock (3 available)
The Cat in the Hat (Beginner Books B-1),Childrens,£16.26,Two,        In stock (3 available)
The Case for Christ (Cases for Christianity),Add a comment,£47.84,One,        In stock (3 available)
The Book Thief,Default,£53.49,Two,        In stock (3 available)
The Book of Basketball: The NBA According to The Sports Guy,Sports and Games,£44.84,Five,        In stock (3 available)
The Blind Side: Evolution of a Game,Add a comment,£53.71,Five,        In stock (3 available)
The Autobiography of Malcolm X,Default,£23.43,Two,        In stock (3 available)
"The Art of Simple Food: Notes, Lessons, and Recipes from a Delicious Revolution",Food and Drink,£34.32,Three,        In stock (3 available)
The Art of Fielding,Fiction,£22.10,One,        In stock (3 available)
"Surely You're Joking, Mr. Feynman!: Adventures of a Curious Character",Science,£25.83,Two,        In stock (3 available)
Stiff: The Curious Lives of Human Cadavers,Nonfiction,£36.74,Three,        In stock (3 available)
Spilled Milk: Based on a True Story,Nonfiction,£49.51,One,        In stock (3 available)
Something Borrowed (Darcy & Rachel #1),Womens Fiction,£48.96,Five,        In stock (3 available)
Something Blue (Darcy & Rachel #2),Womens Fiction,£54.62,One,        In stock (3 available)
Soldier (Talon #3),Fantasy,£24.72,Two,        In stock (3 available)
Shopaholic & Baby (Shopaholic #5),Default,£46.45,Two,        In stock (3 available)
Seven Days in the Art World,Add a comment,£52.33,Two,        In stock (3 available)
Seven Brief Lessons on Physics,Science,£30.60,Four,        In stock (3 available)
Scarlet (The Lunar Chronicles #2),Young Adult,£14.57,Four,        In stock (3 available)
Sarah's Key,Add a comment,£46.29,One,        In stock (3 available)
"Saga, Volume 3 (Saga (Collected Editions) #3)",Sequential Art,£21.57,Five,        In stock (3 available)
Running with Scissors,Autobiography,£12.91,Four,        In stock (3 available)
Rogue Lawyer (Rogue Lawyer #1),Add a comment,£50.11,Three,        In stock (3 available)
"Rise of the Rocket Girls: The Women Who Propelled Us, from Missiles to the Moon to Mars",Nonfiction,£41.67,Four,        In stock (3 available)
Rework,Business,£44.88,Two,        In stock (3 available)
Reservations for Two,Romance,£11.10,Three,        In stock (3 available)
Red: The True Story of Red Riding Hood,Childrens,£28.54,Three,        In stock (3 available)
Ready Player One,Science Fiction,£19.07,Four,        In stock (3 available)
Quiet: The Power of Introverts in a World That Can't Stop Talking,Default,£43.55,One,        In stock (3 available)
Prodigy: The Graphic Novel (Legend: The Graphic Novel #2),Sequential Art,£43.63,Three,        In stock (3 available)
Persepolis: The Story of a Childhood (Persepolis #1-2),Sequential Art,£39.13,One,        In stock (3 available)
Packing for Mars: The Curious Science of Life in the Void,Default,£56.68,Two,        In stock (3 available)
Outliers: The Story of Success,Nonfiction,£14.16,One,        In stock (3 available)
Original Fake,Sequential Art,£31.45,Three,        In stock (3 available)
Orange Is the New Black,Default,£24.61,Two,        In stock (3 available)
One for the Money (Stephanie Plum #1),Default,£32.87,Two,        In stock (3 available)
Notes from a Small Island (Notes From a Small Island #1),Nonfiction,£40.17,One,        In stock (3 available)
Night (The Night Trilogy #1),Nonfiction,£13.51,One,        In stock (3 available)
